{
  "capability": "workload",
  "component": "github-mcp-server",
  "env": {
    "OTEL_EXPORTER_OTLP_ENDPOINT": "http://otlp.monitoring.svc:4318",
    "OTEL_SERVICE_NAME": "mcp-github"
  },
  "name": "github-mcp",
  "port": 8082,
  "purpose": "hydrated from the live tree; was mcp/github-mcp",
  "replicas": 2,
  "size": "m"
}
