{
  "capability": "workload",
  "component": "sovereign-worker",
  "env": {
    "ESTATE_HOME": "/tmp/estate",
    "HOME": "/tmp",
    "TEMPORAL_HOST": "temporal-frontend.temporal.svc",
    "TEMPORAL_NAMESPACE": "estate",
    "TEMPORAL_PORT": "7233"
  },
  "name": "sovereign-worker",
  "purpose": "hydrated from the live tree; was temporal/sovereign-worker",
  "replicas": 2,
  "size": "m"
}
