{
  "capability": "workload",
  "component": "estate-mcp",
  "env": {
    "ESTATE_CATALOG_PATH": "/data/catalog-info.yaml",
    "ESTATE_DB_PATH": "/data/estate.db",
    "ESTATE_INVENTORY_BYTE_CEILING": "8000",
    "ESTATE_STATE_JSON_PATH": "/data/estate-state.json",
    "ESTATE_STATE_MD_PATH": "/data/STATE.md",
    "OTEL_EXPORTER_OTLP_ENDPOINT": "http://otlp.monitoring.svc:4318",
    "OTEL_SERVICE_NAME": "mcp-estate"
  },
  "name": "estate-mcp",
  "port": 8001,
  "purpose": "hydrated from the live tree; was mcp/estate-mcp",
  "replicas": 2,
  "size": "m"
}
