{
  "capability": "workload",
  "component": "litellm-database",
  "env": {
    "GENERIC_SCOPE": "openid email profile",
    "GENERIC_USER_EMAIL_ATTRIBUTE": "email",
    "GENERIC_USER_ID_ATTRIBUTE": "email",
    "HOME": "/tmp",
    "LANGFUSE_HOST": "http://langfuse-web.observability.svc:3000",
    "LITELLM_LOG": "INFO",
    "OTEL_EXPORTER": "otlp_http",
    "OTEL_EXPORTER_OTLP_ENDPOINT": "http://otlp.monitoring.svc:4318",
    "PYTHONPATH": "/etc/litellm/ceilings"
  },
  "name": "litellm",
  "port": 4000,
  "public_host": "llm",
  "purpose": "hydrated from the live tree; was llm/litellm",
  "replicas": 2,
  "size": "l"
}
